{
  "schemaVersion": "1.1",
  "messageId": "0191b9eb-dbf9-79ac-9e1d-13e31c8294e3",
  "messageType": "DISPOSAL_EVENT_V1",
  "deviceCode": "ESP32-001",
  "bootId": "0191b9ea-6d14-7402-89a8-6ac3a4d24f8b",
  "sequence": 184,
  "occurredAt": "2026-08-22T14:28:11.123Z",
  "timeQuality": "DEVICE_SYNCED",
  "firmwareVersion": "smart-waste-esp32-1.0.0",
  "payload": {
    "eventId": "0191b9e8-ee15-76af-89f9-ce1470a0812f",
    "sessionId": "0191b9e8-eef4-7e5c-b43d-9f3668c37a5d",
    "eventSource": "HARDWARE",
    "selectedCompartment": "DRY",
    "trigger": {
      "componentCode": "ir-dry-1",
      "triggered": true,
      "quality": "GOOD",
      "capturedAt": "2026-08-22T14:28:11.123Z"
    },
    "measurements": [],
    "location": { "fixQuality": "NO_FIX" }
  },
  "extensions": {}
}
